id_komentar,nama_akun,tanggal,text_cleaning,sentimen
UgxEbDz5ljb9L3B3OJZ4AaABAg,Adi Sapri,2023-06-07 11:16:18+00:00,luhut muldoko   fikirin bangkrut    ,0
UgyDJDC9oFxwgUIcQkl4AaABAg,Andy Walkman,2023-07-03 02:35:04+00:00,masalah bukan stasiun charging harga mahal jt mini beli bbm bagus,0
Ugwp5g9tS5FJtdpuoZF4AaABAg,Mohita Official,2023-07-04 05:06:54+00:00,  jelas market mau high end   laku kayak avanza mana mau laku keras low end harga avanza segmen masyarakat low end harga high end   capai,2
UgxODkQhbNgTeHicdqV4AaABAg,Multiverse,2023-06-08 03:55:50+00:00,tempat charger ev batas kota besar harga ev cenderung lebih mahal lcgc masyarakat lebih tarik beli lcgc solusi spbu pertamina wajib punya charger ev harga ev murah minimal sama lcgc seri bawah jual ev bakal naik,2
UgzLRnIv0Ks3fW3BGcl4AaABAg,Jefry,2023-06-07 02:34:30+00:00,benerin dulu transportasi umum baru ngomong kendara ibarat  orang  jalan   mas seok suruh lari yya ambruk,0
UgyscdFolRP2x0L0AYF4AaABAg,wawang gatot,2023-06-06 21:39:18+00:00,suruh temen luhut sama moeldoko     beli     minat     punya duit,2
UgwrbdWh0iein7Ou8414AaABAg,Dangdut Mania Channel,2023-06-26 12:30:21+00:00,masyarakat kecil mana beli,0
UgyqeMsF3ZHsu4qXT6V4AaABAg,KONTOLE_DOWO,2022-12-18 12:51:29+00:00,wacana sama esemka,1
Ugz1x33Kdt-nm9Ts7gh4AaABAg,Yuyun Samonhir,2023-06-07 13:00:20+00:00,subsidi pupuk pangkas subsidi pangkas subsidi bbm pangkas subsidi pupuk pangkas alasanya beban uang negara pas minta subsidi besar besar padahal subsidi   pangkas rakyat subsidi kalang atas darisini paham mana wong cilik otak mana otak,0
UgzXLPsa5i0sFpjZHMN4AaABAg,Sigit Hadi Pratomo,2023-06-17 15:17:13+00:00,harga mahal jarak tempuh dekat bengkel susah,0
UgzMZ86yeNtFLFjcQ-14AaABAg,wikiwor wikipedia,2023-03-16 01:41:58+00:00,nunggu murah harga juta beli,2
UgzwK3omyJprkqZaddJ4AaABAg,Itsumo Saiko,2023-06-11 17:01:28+00:00,bagaimana kenderaan elektrik indonesia nak laku pusat changer   cukup jalan raya buruk apa kuasa beli rata rakyat indonesia rendah walaupun duduk ramai,0
UgyXU7lB-DIG5SHCROp4AaABAg,Daniel Heryanto,2023-06-09 02:31:53+00:00,infrastruktur kendara   rata  gimana  masyarakat mau ahli,2
UgxzGDR1tJmLN2d69U94AaABAg,pangeran sriwijaya,2023-06-13 12:32:04+00:00,kendara bagus angkut umum,1
UgxZ9gctLh3w5wDPn_h4AaABAg,johan azam,2023-06-07 12:09:27+00:00,  ingin rakyat sejahtera   rata lapang kerja   banyak sembako jangkau,2
UgwaGW7pL8OUT4-GHVJ4AaABAg,Ika Setiana,2023-06-09 14:59:18+00:00,jt model kayak becak kasih body mending buat beli rumah om,0
UgyEdAyP5ehYzf8n0at4AaABAg,Frane Xavi,2023-06-07 06:11:22+00:00,harga sama pilih   lebih aman,2
UgzopKbD6Pu1CLWLUvB4AaABAg,lukman bandolz,2023-06-16 00:03:44+00:00,  beli tengah atas banyak masyarakat tengah bawah motor dealernya   terasebar kota besar   daerah mungkin difikirkan beli,0
UgwGSkEEWUAIe4iA0P54AaABAg,"Hi, 1626",2023-06-25 07:37:37+00:00,  statement miris jual ev ngebandingin nilai jual konvensional krg tepat sebut   misal ranah otomotif   baru perlu sesuai bagai narasi   buruk kondisi sungguh entah apa tuju lebih tepat   misal nampilin tabel growth jual awal kenal simpul akhir tolak belakang berita,0
UgzFrcfZ9Y7qd_suG254AaABAg,Joko Listianto,2023-06-06 14:28:57+00:00,  pindah haluan   pake duit gp la semua biaya padahal mampu ekonomi jd kwndala bnyak kutat mas ekonomi blm   bla bla bla,0
UgyXpUgRo0UfnX5aeCF4AaABAg,POLTAK 313,2023-06-07 03:04:11+00:00,mana sih wuliing banyak bet sering papar jalan,1
UgygnK75teGhTUbGdfl4AaABAg,DaniAzis Sawanganelok,2023-06-07 07:03:19+00:00,  butuh masyarakat kecil bukan butuh lowong pekerjan,0
UgwtjBJEfJIyNYrZxlR4AaABAg,Agate Slate,2023-06-06 14:49:43+00:00,gampang tinggal hapus subsidi bbm jual bakal langsung naik,2
UgyCHUxOzvBAoR3Ih2t4AaABAg,Mr. Jack,2023-06-07 03:55:48+00:00, malas  banget  lihat  wajah muldx,1
UgzrBBTudqr01K6jHRN4AaABAg,aara ayesha,2023-06-13 07:46:13+00:00,perintah tak mampu rubah meski diskon mungkin   baterai universal ganti mana semua kendara jenis apa sama model lebih mudah motor maka baterai sama misal motor batetai kapasitan baterai mudah isi masyarakan bisnis isi baterai tinggal ganti unit baterai,0
UgxjV2FjkUFE23JpaCd4AaABAg,Aris Ris,2023-07-28 23:58:30+00:00,iklan kudu kencang,1
UgxMZFfOMdGKNwZdLOR4AaABAg,Fahreza Reza,2023-06-07 08:16:44+00:00,mahal bro contoh wuling ev negara   jt an indonesia jt an,2
UgwcXVbJCQcNiCKk8Z94AaABAg,MR REE,2023-06-17 11:38:30+00:00,salah satu   mahal,0
UgwdrLx5c0PEuD63jjR4AaABAg,The WakeUp Call,2023-06-29 01:28:48+00:00,  masyarakat percaya jangan paksa paksa lebih baik riset jadi ful bbm kelapa sawit nanti masyarakat tawar pilih ice bbm baru bev value for moneynya lebih besar pilih masyarakat,0
UgzxDp4SylFQaWrKBWt4AaABAg,Sri Atin,2023-06-06 13:44:27+00:00,terlalu mahal   pakai kota,0
Ugz8uyDx5LgUKAU1yT94AaABAg,Skt Brown,2023-06-07 05:51:42+00:00,masalah ukur harga jangkau perintah beda jauh arti harga jangkau masyarakat kata perintah jtan jangkau wuling ev masyrakat motor   jtan beli cicil itu banyak macet cicil mimpi basah siang bolong   laku,0
UgycHZeCZqYVdj-LC8V4AaABAg,Nanang Kurniawan,2023-06-06 15:33:21+00:00,subsidi tai subsidi lari usaha subsidi ngapa   benah ekonomi sumberdaya manusia dasar tolol   bikin bijak,0
UgynB3UidfEF4bLdBLV4AaABAg,Dia Melisah,2023-03-19 15:22:13+00:00,wacana tuju orang   milik uang lebih   beli buat subsidi gt mending uang buat sumbang rakyat     mampu bnyak rakyat   hidup kurang buat makan   susah boro beli,0
UgwLY1z5dzMDjPf8Eyp4AaABAg,Ismail Hawari,2023-06-07 06:03:56+00:00,rakyat lebih butuh subsidi bbm didik sehat rakyat kecil   beli   subsidi baru mau  orang  kaya  kok  subsidi gelo,0
UgwEKKMCKPUbxab_KSN4AaABAg,Herman Tito,2023-06-09 06:21:24+00:00,pribadi sih motor sangat bahaya suara mesin knalpot jalan belok anggap   kendara malah timbul crash   suara oke sebut klakson seperti   semua orang reflek   belok blind spot pencet klakson,0
UgypCY9vLqG6-pzybmt4AaABAg,Anif Wijayanto,2023-06-07 06:17:07+00:00,butuh proses dukung bukan lemah wong tuju masuk akal positif kaum oposisi cuma jual kata kata mulus ambisi politik,0
UgzcZ6Ezv5QRVcavFjB4AaABAg,TUHAN bukan orang ARAB Bilangan XXIII 19,2023-06-07 12:03:32+00:00,masyarakat indonesia mau beli ancam negara negara arab jual minyak mentah klaim pegang kunci sorga,2
UgziE-8JaTs9qOcHYiV4AaABAg,Aldi Alvaro Winata™,2023-06-06 15:55:03+00:00,hahaha sukurin   laku mampus   lagi ribet sih tenaga bbm   ribet antri spbu tenaga makin jam kurang efisien,0
UgyIjX41kIBdZ0zMAyt4AaABAg,Toko Jelek Surabaya,2023-06-14 23:37:45+00:00,imho alas kurang emisi sesat lama pln pakai indonesia mayoritas hasil bakar batu bara gas cuman plta potensial air data coba cek   percaya alih bensin   signifikan kurang emisi bisnis satu bisnis lain indonesia lebih   serap padahal lanjur kontrak besar sama punya tambang batu bara mau bensin apa batu bara sama lama transportasi massal susah   baik   niat beneran mau rangin emisi,0
UgxoR8cd6kN4gh7V4Qx4AaABAg,Abang Aeyadi,2023-06-07 13:29:12+00:00,siapa   bl motor lm jual besi bekas harga besi rongsok,2
UgyrKpO_VpK78yfAOgN4AaABAg,Sutris chanel,2023-03-20 23:35:54+00:00,motor batrai nyewa mungkin berat hitung lebih boros motor bensin banyak motor   jarang jalan,0
Ugy2UEbjpHAxHI1bdnl4AaABAg,Apca Ramdhan,2023-07-01 12:04:00+00:00,goblok   naek gunung fasilitas sarana tukar baterai   ujung dorong fasilitas dulu bangun baru dorong alih banyak korupsi sih jabat konoha anjing cuih goblok,0
Ugz8Wh3wCl3YyOGYktp4AaABAg,bony merakjayabeton,2023-06-21 05:01:02+00:00,masalah warga indo banyak     punya mampu beli kendara roda mikir orang   beli mending deh pikirin transportasi umum mudah hidup masyarakat,0
UgxjUmmlFFoGsKbbI3l4AaABAg,Muhammad Taufik Akbar,2023-06-07 10:48:35+00:00,      infrastruktur charger minim,0
Ugy37pvJ8qKzO-HoqBB4AaABAg,~tan.xin.jin88,2023-06-07 05:10:18+00:00,  milik pertama tiap milik gratis niscaya laris manis,2
UgzTxuI8tgbYX3xyNOd4AaABAg,mulkan mulkan,2023-03-07 11:33:45+00:00,apa pengaruh juta harga   juta,2
UgyOjA20wbTxZBSUphd4AaABAg,ngipi_ngolah pikir,2023-06-08 02:05:19+00:00,gampang to tinggal gx usah import bbm beres,0
UgyOqcgp6YzLL4eV3fN4AaABAg,Dymas Rp,2023-06-06 13:38:58+00:00,buat cina marak sih kualitas material payah,2
UgzrIme6uSs4MNMLKPF4AaABAg,Albert,2023-06-07 03:03:23+00:00,title berita tak laku at the same time tampil data jual tingkat,0
Ugx0b2ZluAH4WkqqG1F4AaABAg,passaku 7,2023-06-13 01:37:11+00:00,bukan   laku mobilitas batas tambah ngecas pake waktu beda sama bensin ngisi langsung gas,0
UgyNw5lEkzD6hE1v8Ax4AaABAg,Ryan Yhuan,2023-06-07 13:44:38+00:00,  harap harap sejahtera makan hari,1
UgznraF4ni4OYCPI42h4AaABAg,Jaynou Oliver Beck,2023-06-06 13:31:59+00:00,nunggu kabel charger type c,2
UgxLN4yCmAmo1Jw8u_t4AaABAg,Teguh Utomo,2023-06-07 22:39:15+00:00,jt umur  tahun  blm prnah punya tabung jt gaji sbln jt sih ,2
Ugx0iEppyuFyXBGyJSJ4AaABAg,Severinus Maha,2023-06-10 10:05:28+00:00,jga tetap dunia paksa terima nyata stop produksi bbm orang paksa bbm   produksi,0
UgzgkfS5H3hTzJEU8bB4AaABAg,Arif Kalulut,2023-06-07 02:38:55+00:00,  harga mahal cuba harga jt psti laku keras,2
UgxQ14At2qa6S_TyW2N4AaABAg,Kolik Kulik,2023-06-07 04:05:09+00:00,berita tendensius   imbang maluin media besar banding bensin lebih laku bensin alih liat growth antusiasme   tesla kelas atas minat batas gitu   masak   paham,0
UgymraUWUIVzC0ITJBx4AaABAg,Eko Ipah,2023-06-13 04:14:13+00:00,kendara terlalu mahal kalang duit   mampu beli,0
UgwV5f0zBhMro8H3LUB4AaABAg,jolio ahmad,2023-06-13 05:00:06+00:00,  tau produsen   rakyat konoha lebih  orang  miskin kaya artis jabat   beli rumah   nyicil abad boro boro bayar   sulit,0
UgyjTKKTMAoLuRJ-cYh4AaABAg,Nur Rohman,2023-06-26 11:48:47+00:00,subsidi tepat mnurut dapat lebih baik dipake   pupuk subsidi solar nelayan,2
UgxzqAepJwspvirHU6l4AaABAg,Robet rvb,2023-06-06 17:41:51+00:00,moeldoko adaalah milik usaha motor motor gesit wajar koar masyarakat pindah kendara pernah kritik perintah cepat kesah undang undang subsidi kendara produk beli perintah,0
UgxDYgMh3FOscyKh2-R4AaABAg,channel phone,2023-06-13 09:57:44+00:00,harga china jt sampe sini dibandrol jt subsidi jt konsumen jt harga china wuling miniev rpjt indonesia jt,2
UgwE4-s8ewLYd13gsB14AaABAg,Muhsin Fath,2023-06-11 07:58:14+00:00,bantu pajak kokuntuk menuhin jalan raya bikin macet kocag transportasi umum banyakin aduh ampun investor akal sehat ilang,0
UgxOqECwof8TjzZNbCp4AaABAg,Asni Muchtasar,2023-06-06 23:02:39+00:00,  mau laku bebasin pajak kendara rp semua orang pindah kendara,0
UgwxJ_5SRix_HGLgIwR4AaABAg,Joe R Lee,2023-06-07 17:16:26+00:00,alhamdulilah dulu kalah sama kendara bensin   lebih modern sejarah jg dulu selalu kalah,2
UgywYBoD3EZwkWpUtQN4AaABAg,Cloud Clone,2023-06-08 02:44:55+00:00,misal indonesia kasih bonus panel surya atas mungkin unggul panel surya kualitas indonesia musim,2
UgwljytkSFt_vfbo7n94AaABAg,Langkah Pasti,2023-06-07 22:50:22+00:00,inti teknologi coba coba makanya   laku coba coba harga mahal,2
UgxRq66-szcSa6rkEO94AaABAg,hu hu,2023-06-24 01:44:30+00:00,indonesia daerah banjir bahaya kendara motor cuci   bakar kemarin,0
UgxyO_-d7B06b9bG15x4AaABAg,vania,2023-06-14 01:02:34+00:00,lha beda apa ev jg bbm,0
UgwaG-xEzdg7XjYJLp94AaABAg,al faisal,2023-03-20 06:07:53+00:00,subsidi   kurang tepat  ,0
UgxPhwxuDT8hmxSDTdN4AaABAg,Ranap Wijaya,2023-06-07 07:06:18+00:00,sharusnya   bahan bakar minyak kurang banyak   lari tenaga,0
Ugyk0MpPOR9gp1EXS2x4AaABAg,arcel alindra,2023-06-06 17:06:09+00:00,moeldoko sama si luhut punya saham besar mati an ngebela jual jabat cuma penting diri pribadi,1
Ugy5Cc8BRPnXnxPENcR4AaABAg,Soe weton oi,2023-06-07 07:18:09+00:00,jalan umum masyarakt dibperbaiki lancat tak berlobag lagidi nkri,2
Ugz2YiYpwSHi5kcjkWR4AaABAg,Karso Indra Offesial.,2023-06-07 07:06:16+00:00,bisnis orang perintah coba klu buat bis adan angkut umum,2
UgycN9VgsU8g5oRO1jR4AaABAg,Nur,2023-03-18 20:17:58+00:00,subsidi  kok  kendara alangkah baik angarannya buat bangun pabrik pupuk tani susah sekarang tolong pikir nasip tani,2
UgwuyFTfOiDqA9h1Aq54AaABAg,enthen zhuo,2023-06-30 14:34:01+00:00,kota besar   macet pake ev daerah   jarang macet bisa ev harga mahal ev ev   jt sangat layak model paksa sangat layak keluar kota,0
Ugz0dD3Gjhd-Gp9Ppdl4AaABAg,Jefri jefri,2023-06-08 03:46:14+00:00,mahal dikit pilih charging station dikit indonesia apartemen   baik   deh penting,0
